{
  "schema_version": "nextstat.snapshot_index.v1",
  "generated_at": "2026-02-08T20:00:00Z",
  "snapshot_id": "gha-1234567890-1-deadbeefcafe",
  "suite": "apex2-nightly-slow",
  "git": {
    "sha": "deadbeefcafebabefeedface0123456789abcdef0123456789abcdef01234567",
    "ref": "refs/heads/main",
    "repository": "NextStat/nextstat.io"
  },
  "workflow": {
    "GITHUB_WORKFLOW": "Apex2 Nightly Slow Validations",
    "GITHUB_RUN_ID": "1234567890",
    "GITHUB_RUN_ATTEMPT": "1",
    "RUNNER_OS": "Linux",
    "RUNNER_ARCH": "X64"
  },
  "artifacts": [
    {
      "path": "validation_pack_manifest.json",
      "bytes": 579,
      "sha256": "d23dd60ae80698cc140f2c1c4318eac9028042446a2ebe081befbb52aad3f9c6"
    },
    {
      "path": "validation_report.json",
      "bytes": 6122,
      "sha256": "aaaaaaaaaaaaaaaaaaaaaaaaaaaaaaaaaaaaaaaaaaaaaaaaaaaaaaaaaaaaaaaa"
    }
  ],
  "suite_health": [
    {
      "suite": "bayesian",
      "assessment_path": "bayesian/bayesian_assessment.json",
      "assessment_sha256": "bbbbbbbbbbbbbbbbbbbbbbbbbbbbbbbbbbbbbbbbbbbbbbbbbbbbbbbbbbbbbbbb",
      "assessment_schema_version": "nextstat.bayesian_assessment.v1",
      "core_quality": {
        "passed": true,
        "status": "passed",
        "failure_count": 0,
        "warning_count": 0
      },
      "promotion_gate": {
        "passed": false,
        "status": "failed",
        "target_backend": "nextstat",
        "failure_count": 1,
        "reviewed_case_count": 4,
        "failing_cases": ["hier_random_intercept_non_centered"],
        "review_summary": {
          "n_reviewed_cases": 4,
          "n_failures": 1,
          "n_failing_cases": 1,
          "failing_cases": ["hier_random_intercept_non_centered"],
          "worst_max_r_hat": {
            "case": "hier_random_intercept_non_centered",
            "value": 1.0142
          },
          "worst_min_ebfmi": {
            "case": "hier_random_intercept_non_centered",
            "value": 0.57
          }
        }
      }
    }
  ]
}
